{
  "$schema": "https://packs.burntandtoast.com/v1/pack.schema.json",
  "pack_format": 1,
  "provider": "anthropic",
  "name": "Anthropic Claude API (stub)",
  "version": "2026.10.15.2",
  "updated": "2026-10-15",
  "status": "stub",
  "notes": [
    "STUB pack to prove the engine is provider-neutral. It contains only facts from Anthropic's model deprecations page (read 15 Oct 2026), for the Claude API. Amazon Bedrock and Google Cloud set their own retirement dates and are NOT covered.",
    "No live API checks have been run against Anthropic. No aliases, eval adapter or fixer rules beyond the documented sampling-parameter deprecation."
  ],
  "sources": [
    {
      "id": "deprecations",
      "title": "Anthropic model deprecations",
      "url": "https://docs.anthropic.com/en/docs/about-claude/model-deprecations",
      "checked": "2026-10-15"
    }
  ],
  "id_patterns": [
    {
      "pattern": "claude-[a-z0-9][a-z0-9.-]*[a-z0-9]"
    }
  ],
  "migrations": [
    {
      "id": "claude-sonnet-4-5-2026-11-30",
      "title": "Anthropic retires Claude Sonnet 4.5 on the Claude API",
      "announced": "2026-09-30",
      "shutdown": "2026-11-30",
      "replacement": "claude-sonnet-5-5",
      "headline": true,
      "source": "deprecations"
    }
  ],
  "models": [
    {
      "id": "claude-sonnet-4-5-20250929",
      "kind": "snapshot",
      "shutdown": "2026-11-30",
      "replacement": "claude-sonnet-5-5",
      "section": "2026-09-30: Claude Sonnet 4.5 model",
      "confidence": "confirmed",
      "source": "deprecations",
      "note": "Deprecated 30 Sep 2026; retires 30 Nov 2026 on the Claude API.",
      "migration": "claude-sonnet-4-5-2026-11-30"
    },
    {
      "id": "claude-opus-4-1-20250805",
      "kind": "snapshot",
      "shutdown": "2026-08-05",
      "replacement": "claude-opus-4-8",
      "section": "2026-06-05: Claude Opus 4.1 model",
      "confidence": "confirmed",
      "source": "deprecations",
      "note": "Already retired; requests fail."
    },
    {
      "id": "claude-sonnet-4-20250514",
      "kind": "snapshot",
      "shutdown": "2026-06-15",
      "replacement": "claude-sonnet-5-5",
      "section": "2026-04-14: Claude Sonnet 4 and Claude Opus 4 models",
      "confidence": "confirmed",
      "source": "deprecations",
      "note": "Already retired; requests fail."
    },
    {
      "id": "claude-opus-4-20250514",
      "kind": "snapshot",
      "shutdown": "2026-06-15",
      "replacement": "claude-opus-4-8",
      "section": "2026-04-14: Claude Sonnet 4 and Claude Opus 4 models",
      "confidence": "confirmed",
      "source": "deprecations",
      "note": "Already retired; requests fail."
    },
    {
      "id": "claude-3-haiku-20240307",
      "kind": "snapshot",
      "shutdown": "2026-04-20",
      "replacement": "claude-haiku-4-5-20251001",
      "section": "2026-02-19: Claude Haiku 3 model",
      "confidence": "confirmed",
      "source": "deprecations",
      "note": "Already retired; requests fail."
    },
    {
      "id": "claude-3-5-haiku-20241022",
      "kind": "snapshot",
      "shutdown": "2026-02-19",
      "replacement": "claude-haiku-4-5-20251001",
      "section": "2025-12-19: Claude Haiku 3.5 model",
      "confidence": "confirmed",
      "source": "deprecations",
      "note": "Already retired; requests fail."
    },
    {
      "id": "claude-3-7-sonnet-20250219",
      "kind": "snapshot",
      "shutdown": "2026-02-19",
      "replacement": "claude-sonnet-5-5",
      "section": "2025-10-28: Claude Sonnet 3.7 model",
      "confidence": "confirmed",
      "source": "deprecations",
      "note": "Already retired; requests fail."
    },
    {
      "id": "claude-3-5-sonnet-20240620",
      "kind": "snapshot",
      "shutdown": "2025-10-28",
      "replacement": "claude-sonnet-5-5",
      "section": "2025-08-13: Claude Sonnet 3.5 models",
      "confidence": "confirmed",
      "source": "deprecations",
      "note": "Already retired; requests fail."
    },
    {
      "id": "claude-3-5-sonnet-20241022",
      "kind": "snapshot",
      "shutdown": "2025-10-28",
      "replacement": "claude-sonnet-5-5",
      "section": "2025-08-13: Claude Sonnet 3.5 models",
      "confidence": "confirmed",
      "source": "deprecations",
      "note": "Already retired; requests fail."
    },
    {
      "id": "claude-3-opus-20240229",
      "kind": "snapshot",
      "shutdown": "2026-01-05",
      "replacement": "claude-opus-4-8",
      "section": "2025-06-30: Claude Opus 3 model",
      "confidence": "confirmed",
      "source": "deprecations",
      "note": "Already retired; requests fail."
    }
  ],
  "signals": [
    {
      "id": "anthropic_sdk",
      "sdk": "anthropic",
      "languages": [
        "python"
      ],
      "pattern": "\\bimport anthropic\\b|\\bfrom anthropic import\\b|\\bAnthropic\\(",
      "description": "anthropic Python client"
    },
    {
      "id": "anthropic_sdk",
      "sdk": "anthropic",
      "languages": [
        "javascript",
        "typescript"
      ],
      "pattern": "@anthropic-ai/sdk|new\\s+Anthropic\\(",
      "description": "anthropic JS/TS client"
    },
    {
      "id": "langchain_anthropic",
      "sdk": "langchain",
      "languages": [
        "python",
        "javascript",
        "typescript"
      ],
      "pattern": "\\bChatAnthropic\\(|langchain_anthropic|@langchain/anthropic"
    },
    {
      "id": "http_anthropic",
      "sdk": "http",
      "languages": [
        "python",
        "javascript",
        "typescript",
        "yaml",
        "json",
        "env"
      ],
      "pattern": "api\\.anthropic\\.com/v1"
    },
    {
      "id": "messages_api",
      "languages": [
        "python",
        "javascript",
        "typescript"
      ],
      "pattern": "messages\\.(?:create|stream)|/v1/messages",
      "call": {
        "callees": [
          "messages.create",
          "messages.stream",
          "messages.parse"
        ]
      }
    },
    {
      "id": "claude_sampling",
      "languages": [
        "python",
        "javascript",
        "typescript"
      ],
      "pattern": "\\btemperature\\b|\\btop_p\\b|\\btop_k\\b",
      "call": {
        "params": [
          "temperature",
          "top_p",
          "top_k"
        ]
      }
    }
  ],
  "rules": [
    {
      "id": "claude-sampling-deprecated",
      "type": "param_removed",
      "applies_to": {
        "replacements": [
          "claude-sonnet-5-5",
          "claude-opus-4-8",
          "claude-sonnet-5",
          "claude-opus-5",
          "claude-opus-5-5",
          "claude-opus-4-7",
          "claude-haiku-5-5"
        ]
      },
      "when_any": [
        "claude_sampling"
      ],
      "param": "temperature,top_p,top_k",
      "risk": "high",
      "confidence": "inferred",
      "evidence": "Anthropic docs: temperature/top_p/top_k return 400 at non-default values on Claude 4.7 and later; Python SDK v1.0+ removes them (TypeError). We infer the listed replacements count as '4.7 and later'.",
      "message": "Sets temperature/top_p/top_k: on Claude 4.7 and later models these return HTTP 400 at non-default values, and the anthropic Python SDK v1.0+ raises TypeError. Remove them and guide behaviour with prompting.",
      "fix": {
        "action": "remove_param",
        "params": [
          "temperature",
          "top_p",
          "top_k"
        ],
        "requires_new_model": false,
        "note": "Inferred rule: shown for manual review unless you pass --include-inferred."
      }
    }
  ],
  "risk_policy": {
    "urgent_days": 30,
    "default_risk": "medium"
  },
  "facts": {
    "confirmed": [
      "claude-sonnet-4-5-20250929 is deprecated and retires on the Claude API on 30 Nov 2026; recommended replacement claude-sonnet-5-5.",
      "Anthropic gives at least 60 days' notice before retiring publicly released models.",
      "Amazon Bedrock and Google Cloud set their own retirement schedules; these dates apply to Anthropic-operated platforms only.",
      "temperature, top_p and top_k are deprecated on Claude 4.7 and later models (400 at non-default values)."
    ],
    "unconfirmed": [
      "This is a stub pack: no live checks, no alias data, and replacements' parameter behaviour beyond the docs is untested."
    ]
  },
  "report": {
    "next_steps": [
      "Swap retired Claude model ids for the recommended replacements, remove temperature/top_p/top_k where targeting Claude 4.7+, and run a regression eval."
    ]
  }
}
